Date,State,Bill,Bill Description,Bill Type,Status,Bill Link
2022-05-03,United States,HB7662,"Prohibits an elementary school from receiving federal education funds unless a teacher requests written parental consent prior to teaching a lesson specifically related to gender identity, sexual orientation, or transgender studies. In particular, the bill requires a teacher to request written consent from the parent of each student enrolled in the class prior to teaching the lesson. If a parent does not submit written consent to the lesson, then the school must provide the student with an alternative period of learning or study hall. Further, the teacher may not teach the lesson if the principal does not receive written consent from the parents of at least 50% of the students enrolled in the class.",Other,Introduced,https://legiscan.com/US/bill/HB7662/2021
2022-05-03,United States,SB4131,"Disallows a business expense tax deduction for any reimbursement paid by an employer to an employee for travel expenses to obtain an abortion, or for the costs of any gender transition procedure for the employee's minor child.",Healthcare,Introduced,https://legiscan.com/US/bill/SB4131/2021
2022-05-02,Tennessee,HB1895,"As enacted, requires the commissioner of education to withhold a portion of the state education finance funds that an LEA is otherwise eligible to receive if the LEA fails or refuses to determine a student's gender, for purposes of participation in school sports, by the student's sex at the time of birth; exempts an LEA that fails or refuses to determine a student's gender, for purposes of participation in school sports, by the student's sex at the time of birth if the LEA's failure or refusal to do so is required by a court or other legally binding order. - Amends TCA Title 49, Chapter 6.",Youth Athletics,Signed/Enacted,https://legiscan.com/TN/bill/HB1895/2021
2022-05-02,Tennessee,SB1861,"As enacted, requires the commissioner of education to withhold a portion of the state education finance funds that an LEA is otherwise eligible to receive if the LEA fails or refuses to determine a student's gender, for purposes of participation in school sports, by the student's sex at the time of birth; exempts an LEA that fails or refuses to determine a student's gender, for purposes of participation in school sports, by the student's sex at the time of birth if the LEA's failure or refusal to do so is required by a court or other legally binding order. - Amends TCA Title 49, Chapter 6.",Youth Athletics,Signed/Enacted,https://legiscan.com/TN/bill/SB1861/2021
2022-04-29,Arizona,HB2161,Parental rights; schools; educational records,Schools / Education,Signed/Enacted,https://legiscan.com/AZ/bill/HB2161/2022
2022-04-28,Georgia,HB1084,"A BILL to be entitled an Act to amend Title 20 of the O.C.G.A., relating to education, so as to prevent the use of and reliance upon curricula or training programs which act upon, promote, or encourage certain concepts, with exceptions; to provide for related matters; to repeal conflicting laws; and for other purposes.",Schools / Education,Signed/Enacted,https://legiscan.com/GA/bill/HB1084/2021
2022-04-28,Missouri,HB1973,Modifies provisions relating to school activities,Youth Athletics,Crossed Over,https://legiscan.com/MO/bill/HB1973/2022
2022-04-28,Missouri,HB2140,Modifies provisions relating to elections,Youth Athletics,Crossed Over,https://legiscan.com/MO/bill/HB2140/2022
2022-04-26,Tennessee,HB2633,"As introduced, specifies that a teacher or other employee of a public school or LEA is not required to refer to a student using the student's preferred pronoun if the pronoun does not align with the student's biological sex; insulates a teacher or other employee of a public school or LEA from civil liability and adverse employment action for referring to a student using the pronoun aligned with the student's biological sex instead of the student's preferred pronoun. - Amends TCA Title 49, Chapter 6.",Schools / Education,Crossed Over,https://legiscan.com/TN/bill/HB2633/2021
2022-04-26,Oklahoma,SB1100,Vital records; limiting biological sex designation on certificate of birth to male or female; prohibiting nonbinary designation. Emergency.,ID Updates,Signed/Enacted,https://legiscan.com/OK/bill/SB1100/2022
2022-04-22,Florida,H0007,"Provides that subjecting individuals to specified concepts under certain circumstances constitutes discrimination based on race, color, sex, or national origin; revising requirements for required instruction on the history of African Americans; requiring the department to prepare and offer certain standards and curriculum; authorizing the department to seek input from a specified organization for certain purposes; prohibits instructional materials reviewers from recommending instructional materials that contain any matter that contradicts certain principles; requires DOE to review school district professional development systems for compliance with certain provisions of law.",Youth Athletics,Signed/Enacted,https://legiscan.com/FL/bill/H0007/2022
2022-04-14,South Carolina,S1259,"Amend The South Carolina Code Of Laws Article 1, Chapter 47, Title 40 Of The S.c. Code, Relating To General Provisions Concerning Physicians By Adding Section 40-47-205 So As To Prohibit Physicians From Performing Gender Reassignment Surgery On Minors, And To Prohibit Physicians From Prescribing Or Administering Certain Substances For The Purpose Of Attempting To Alter The Appearance Of Or Affirm The Minor's Perception Of His Gender If That Appearance Or Perception Is Inconsistent With The Minor's Biological Sex.",Healthcare,Introduced*,https://legiscan.com/SC/bill/S1259/2021
2022-04-13,Kentucky,SB83,"Amend KRS 156.070 to require the Board of Education or agency designated by the Board of Education to manage interscholastic athletics to promulgate administrative regulations or bylaws requiring schools that participate in interscholastic athletics to designate all athletic teams, activities, and sports based upon the biological sex of the students eligible to participate; prohibit male students from participating in athletic teams, activities, and sports designated as ""girls""; prohibit designated agencies from entertaining complaints or investigations of policies; create a new section of KRS Chapter 158 to create a cause of action against a school that violates these provisions; require that an action be brought within two years; provide that the Act may be cited as the Save Women’s Sports Act.",Youth Athletics,Signed/Enacted,https://legiscan.com/KY/bill/SB83/2022
2022-04-07,Alabama,HB322,"Public schools, restrooms or changing areas, required to be used based on individual's biological sex, kindergarden to fifth grade classroom instruction, limited regarding sexual orientation or gender identity, St. Board of Education to adopt rules",Public Facilities,Signed/Enacted,https://legiscan.com/AL/bill/HB322/2022
2022-04-07,Alabama,SB184,"Public health, minors, biological male or female, sexual state, practices to alter or affirm minor's sexual identity or perception such as prescribing puberty blocking medication or surgeries, prohibited, exceptions, nurses and school personnel not to withhold information from parents, violations a Class C felony",Healthcare,Signed/Enacted,https://legiscan.com/AL/bill/SB184/2022
2022-03-30,Utah,HB3001,Sex-designated Interscholastic Athletics Indemnification,Youth Athletics,Signed/Enacted,https://legiscan.com/UT/bill/HB3001/2022/X3
2022-03-30,Oklahoma,SB2,Student athletics; creating the Save Women's Sports Act; requiring certain athletic teams to be designated based on biological sex. Emergency.,Youth Athletics,Signed/Enacted,https://legiscan.com/OK/bill/SB2/2022
2022-03-30,Arizona,SB1138,Irreversible gender reassignment surgery; minors,Healthcare,Signed/Enacted,https://legiscan.com/AZ/bill/SB1138/2022
2022-03-30,Arizona,SB1165,Interscholastic; intramural athletics; biological sex,Youth Athletics,Signed/Enacted,https://legiscan.com/AZ/bill/SB1165/2022
2022-03-29,Florida,H1557,"Requires district school boards to adopt procedures that comport with certain provisions of law for notifying student's parent of specified information; requires such procedures to reinforce fundamental right of parents to make decisions regarding upbringing & control of their children; prohibits school district from adopting procedures or student support forms that prohibit school district personnel from notifying parent about specified information or that encourage student to withhold from parent such information; prohibits school district personnel from discouraging or prohibiting parental notification & involvement in critical decisions affecting student's mental, emotional, or physical well-being; prohibits classroom discussion about sexual orientation or gender identity in certain grade levels; requires school districts to notify parents of healthcare services; authorizes parent to bring action against school district to obtain declaratory judgment; provides for additional award of injunctive relief, damages, & reasonable attorney fees & court costs to certain parents.",Healthcare,Signed/Enacted,https://legiscan.com/FL/bill/H1557/2022
2022-03-25,Utah,HB0011,Student Eligibility in Interscholastic Activities,Youth Athletics,Signed/Enacted,https://legiscan.com/UT/bill/HB0011/2022
2022-03-24,Oklahoma,HB4245,Student athletics; creating the Save Women's Sports Act; effective date; emergency.,Youth Athletics,Crossed Over,https://legiscan.com/OK/bill/HB4245/2022
2022-03-15,Wisconsin,SB915,An Act to amend 448.02 (3) (a); and to create 146.36 and 632.8983 of the statutes; Relating to: gender transition procedures.,Healthcare,Dead/Failed,https://legiscan.com/WI/bill/SB915/2021
2022-03-15,Wisconsin,AB977,An Act to amend 448.02 (3) (a); and to create 146.36 and 632.8983 of the statutes; Relating to: gender transition procedures.,Healthcare,Dead/Failed,https://legiscan.com/WI/bill/AB977/2021
2022-03-15,Wisconsin,SB322,An Act to amend 118.13 (1); and to create 118.132 of the statutes; Relating to: designating athletic sports and teams operated or sponsored by public schools or private schools participating in a parental choice program based on the sex of the participants.,Youth Athletics,Dead/Failed,https://legiscan.com/WI/bill/SB322/2021
2022-03-15,Wisconsin,AB196,An Act to amend 118.13 (1); and to create 118.132 of the statutes; Relating to: designating athletic sports and teams operated or sponsored by public schools or private schools participating in a parental choice program based on the sex of the participants.,Youth Athletics,Dead/Failed,https://legiscan.com/WI/bill/AB196/2021
2022-03-15,Wisconsin,SB323,An Act to amend 36.12 (1) and 38.23 (1); and to create 36.25 (58) and 38.12 (15) of the statutes; Relating to: designating University of Wisconsin and technical college sports and athletic teams based on the sex of the participants.,Youth Athletics,Dead/Failed,https://legiscan.com/WI/bill/SB323/2021
2022-03-15,Wisconsin,AB195,An Act to amend 36.12 (1) and 38.23 (1); and to create 36.25 (58) and 38.12 (15) of the statutes; Relating to: designating University of Wisconsin and technical college sports and athletic teams based on the sex of the participants.,Youth Athletics,Dead/Failed,https://legiscan.com/WI/bill/AB195/2021
2022-03-14,Florida,S0242,"Requiring each agency head to take certain measures to prevent the use of training for agency employees which espouses certain concepts; authorizing municipalities to provide certain training, workshops, or programming; prohibiting municipalities from providing mandatory employee training that espouses certain concepts; requiring contracts with an agency which are entered into or renewed on or after a specified date to include the option to terminate if the contractor provides workforce training that espouses certain concepts; requiring public K-20 educational institutions to ensure certain diversity and inclusion efforts and to prohibit certain discrimination, etc.",Schools / Education,Dead/Failed,https://legiscan.com/FL/bill/S0242/2022
2022-03-14,Minnesota,HF4282,School-sponsored sports teams required to be designated by biological sex.,Youth Athletics,Introduced,https://legiscan.com/MN/bill/HF4282/2021
2022-03-14,Florida,H0211,Provides criminal penalties for health care practitioners who engage in or cause specified practices to be performed on minor under certain conditions.,Healthcare,Dead/Failed,https://legiscan.com/FL/bill/H0211/2022
2022-03-09,Mississippi,HB1099,An Act To Prohibit Physically Incarcerated Offenders From Requesting A Name Change Or Gender Transition; And For Related Purposes.,ID Updates,Dead/Failed,https://legiscan.com/MS/bill/HB1099/2022
2022-03-08,Idaho,H0675,GENITAL MUTILATION OF A CHILD -- Amends existing law to provide for the crime of genital mutilation in certain instances and to provide certain exemptions.,Other,Crossed Over,https://legiscan.com/ID/bill/H0675/2022
2022-03-08,Wyoming,SF0051,AN ACT relating to school sports; prohibiting biological males from athletic teams and sports designated for females in public schools; establishing related causes of action as specified; requiring rulemaking; and providing for effective dates.,Youth Athletics,Dead/Failed,https://legiscan.com/WY/bill/SF0051/2022
2022-03-04,Utah,HB0127,Medical Practice Amendments,Healthcare,Dead/Failed,https://legiscan.com/UT/bill/HB0127/2022
2022-03-03,Iowa,HF2416,"A bill for an act relating to student eligibility requirements in school district, accredited nonpublic school, regent institution, community college, and certain other institution of higher education athletics based on sex, and including effective date provisions. (Formerly HF 2309.) Effective date: 03/03/2022.",Youth Athletics,Signed/Enacted,https://legiscan.com/IA/bill/HF2416/2021
2022-03-03,Louisiana,HB570,Prohibits certain procedures to alter the sex of a minor child,Healthcare,Introduced,https://legiscan.com/LA/bill/HB570/2022
2022-03-02,West Virginia,SB498,Creating Anti-Racism Act of 2022,Schools / Education,Crossed Over,https://legiscan.com/WV/bill/SB498/2022
2022-03-01,Rhode Island,S2501,Categorizes women by their biological identity at birth rather than their gender identity for purpose of organized sports.,Youth Athletics,Introduced,https://legiscan.com/RI/bill/S2501/2022
2022-02-28,Minnesota,HF3843,Human Rights Act provisions governing gender specific accommodations clarified.,Public Facilities,Introduced,https://legiscan.com/MN/bill/HF3843/2021
2022-02-24,Georgia,SB435,"A BILL to be entitled an Act to amend Title 20 of the Official Code of Georgia Annotated, relating to education, so as to provide that it shall be unlawful for Georgia public schools or participating private schools whose students or teams compete against a Georgia public school to operate, sponsor, or facilitate athletic programs or activities that permit a person of one gender to participate in an athletic program or activity that is designated for persons of the opposite gender; to provide for exceptions; to provide for private rights of action and awards of attorney fees; to provide for legislative findings and intent; to provide for definitions; to provide for a short title; to provide for related matters; to repeal conflicting laws; and for other purposes.",Youth Athletics,Crossed Over,https://legiscan.com/GA/bill/SB435/2021
2022-02-22,Missouri,HB2735,Establishes guidelines for public school student participation in athletic contests organized by sex,Youth Athletics,Introduced,https://legiscan.com/MO/bill/HB2735/2022
2022-02-22,Missouri,HB2734,Establishes guidelines for student participation in athletic contests organized by sex,Youth Athletics,Introduced,https://legiscan.com/MO/bill/HB2734/2022
2022-02-18,United States,HB6764,Establishes a framework to prohibit correctional institutions at the federal and state levels from using gender identity to house inmates of one biological sex with inmates of the other biological sex.,Other,Introduced,https://legiscan.com/US/bill/HB6764/2021
2022-02-17,Iowa,SF2342,"A bill for an act relating to student eligibility requirements in school district, accredited nonpublic school, charter school, community college, and regent institution athletics based on sex.(Formerly SSB 3146.)",Youth Athletics,Introduced*,https://legiscan.com/IA/bill/SF2342/2021
2022-02-16,Iowa,SSB3146,"A bill for an act relating to student eligibility requirements in school district, accredited nonpublic school, charter school, community college, and regent institution athletics based on sex.(See SF 2342.)",Youth Athletics,Introduced*,https://legiscan.com/IA/bill/SSB3146/2021
2022-02-16,Missouri,HB2717,Modifies provisions relating to certificates of birth,ID Updates,Introduced,https://legiscan.com/MO/bill/HB2717/2022
2022-02-14,Kentucky,HB495,Create a new range in KRS Chapter 446 to define terms; establish protections from governmental discrimination against any person or organization for sincerely held religious beliefs and moral convictions regarding the sex of individuals who may enter into marriage; establish administrative and civil remedies for violations.,Nondiscrimination Protections,Introduced,https://legiscan.com/KY/bill/HB495/2022
2022-02-11,Delaware,SB227,"This Act generally requires a student athlete to compete for athletic teams or in sports associated with their biological sex, as determined at or near birth and based on the students birth certificate or other government record if a birth certificate is unobtainable. An exception is permitted to allow female athletes to compete in male sports if a corresponding female sport is not available.",Youth Athletics,Introduced,https://legiscan.com/DE/bill/SB227/2021
2022-02-10,Mississippi,SB2356,An Act To Enact The Real You Act Of 2022; To Define Terms; To Prohibit Physically Incarcerated Offenders From Requesting A Name Change; To Prohibit Minors From Requesting Legal Recognition Of A Gender Transition; To Provide Certain Exceptions; And For Related Purposes.,ID Updates,Dead/Failed,https://legiscan.com/MS/bill/SB2356/2022
2022-02-09,Iowa,HF2309,A bill for an act relating to student eligibility requirements in school district and accredited nonpublic school athletics based on sex.(See HF 2416.),Youth Athletics,Introduced*,https://legiscan.com/IA/bill/HF2309/2021
2022-02-08,Missouri,HB2649,Creates provisions relating to gender transition procedures,Healthcare,Introduced,https://legiscan.com/MO/bill/HB2649/2022
2022-02-07,Oklahoma,SB1249,Municipalities; designating all bathrooms to be single gender; prohibiting ordinances contrary to act. Effective date. Emergency.,Public Facilities,Introduced*,https://legiscan.com/OK/bill/SB1249/2022
2022-02-07,Oklahoma,HB3240,Oklahoma Save Adolescents from Experimentation (SAFE) Act; effective date.,Healthcare,Introduced*,https://legiscan.com/OK/bill/HB3240/2022
2022-02-07,Oklahoma,SB1164,Schools; directing certain restrooms and changing facilities to be designated in certain manner. Effective date. Emergency.,Public Facilities,Introduced*,https://legiscan.com/OK/bill/SB1164/2022
2022-02-04,South Dakota,SB46,Protect fairness in women's sports.,Youth Athletics,Signed/Enacted,https://legiscan.com/SD/bill/SB46/2022
2022-02-03,Tennessee,SB2777,"As introduced, specifies that a teacher or other employee of a public school or LEA is not required to refer to a student using the student's preferred pronoun if the pronoun does not align with the student's biological sex; insulates a teacher or other employee of a public school or LEA from civil liability and adverse employment action for referring to a student using the pronoun aligned with the student's biological sex instead of the student's preferred pronoun. - Amends TCA Title 49, Chapter 6.",Schools / Education,Introduced,https://legiscan.com/TN/bill/SB2777/2021
2022-02-03,Maryland,HB757,Requiring certain interscholastic and intramural athletic teams or sports sponsored by certain schools to be expressly designated based on biological sex; prohibiting certain entities from taking certain adverse actions against a school or county board of education for maintaining separate interscholastic and intramural athletic teams and sports for students of the female sex; and providing that certain individuals have the right to bring a civil action under certain circumstances.,Youth Athletics,Introduced*,https://legiscan.com/MD/bill/HB757/2022
2022-02-03,Alabama,HB266,"Public health, minors, biological male or female, sexual state, practices to alter or affirm minor's sexual identity or perception such as prescribing puberty blocking medication or surgeries, prohibited, exceptions, nurses and school personnel not to withhold information from parents, violations a Class C felony",Healthcare,Introduced,https://legiscan.com/AL/bill/HB266/2022
2022-02-02,Tennessee,SB2696,"As introduced, enacts the “Youth Health Protection Act.” - Amends TCA Title 8; Title 9; Title 14; Title 33; Title 63 and Title 68.",Healthcare,Introduced,https://legiscan.com/TN/bill/SB2696/2021
2022-02-02,Tennessee,HB2835,"As introduced, enacts the “Youth Health Protection Act.” - Amends TCA Title 8; Title 9; Title 14; Title 33; Title 63 and Title 68.",Healthcare,Introduced,https://legiscan.com/TN/bill/HB2835/2021
2022-02-01,West Virginia,HB4016,"The purpose of this bill is to prohibit race or sex stereotyping, biologically and or genetically counter factual instruction, and/or or a biased and historically inaccurate account of comparative political economic systems in 1) instruction provided to pupils in school districts and independent charter schools; and 2) training provided to employees of school boards and independent charter schools. Under the bill, any course or part of any curriculum or pedagogy, or employee training that violates the requirements of the act is prohibited. Among the concepts that are prohibited from being taught under the bill are the following: that one race or sex is inherently superior to another race or sex and that an individual, by virtue of the individual’s race or sex, bears responsibility for acts committed in the past by other individuals of the same race or sex, that persons must recognize identifications contrary to biology and/or genetics, and the presentation of any socialist, communist, or otherwise Marxist, Maoist or critical theory inspired system of political economy without the accurate inclusion of the historically documented scale of state sponsored terror and murder, economic inefficiency, and starvations which have occurred under such forms of political economy and co-equal instructional time dedicated to free-market economies, capitalism and freely elected constitutional democratic republics. The bill provides that the state superintendent of public instruction notify parents and employees of violations of the act, waives sovereign immunity for violations of the act, and provides a private right of action by a parent, guardian or employee for violations of the act.  The bill also requires each school board to post all curricula and training for teachers used in schools in the school district on the school district’s internet site and, if a school board maintains an internet site for an individual school, on the individual school’s internet site. If an internet site is maintained for an independent charter school, the bill requires the authorizer of the independent charter school to ensure that all curricula used in the independent charter school are posted on the independent charter school’s internet site. Under the bill, upon request, a school board or independent charter school operator must provide a printed copy of any curriculum that it is required to post on its internet site, at no cost to the requester.",Schools / Education,Introduced*,https://legiscan.com/WV/bill/HB4016/2022
2022-02-01,South Dakota,HB1005,Provide for the designated use of public school multi-occupancy rooms and sleeping rooms.,Public Facilities,Crossed Over,https://legiscan.com/SD/bill/HB1005/2022
2022-02-01,Mississippi,SB2679,"An Act Entitled The ""transparency In Education Act""; To Provide Parents Of Public School Students Certain Rights Related To Their Child's Education, Including The Right To Review A Syllabus, Curriculum And Teacher-training Materials And Meet With The Teacher To Discuss Course Content, To Require Public Schools To Adopt Procedures To Ensure That A Parent Provides Written Permission Before Their Child Participates In Identity Curriculum Or Critical Theory Curriculum And Allow Parents To Exempt Their Child From Any Specific Lessons That Are Objectionable To The Family, To Direct Public Schools To Hold A Curriculum Night To Allow Parents To Review The Curriculum And Meet With Teachers And Staff, To Provide Parental Access To Certain School District Records Concerning Their Child, To Provide Complaint Procedures; To Amend Section 37-13-9, Mississippi Code Of 1972, In Conformity; And For Related Purposes.",Schools / Education,Dead/Failed,https://legiscan.com/MS/bill/SB2679/2022
