Date,State,Bill,Bill Description,Bill Type,Status,Bill Link
2022-02-01,Mississippi,SB2111,"An Act To Create The Transgender 21 Act; To Prohibit The State, Its Agents, And Political Subdivision From Infringing On A Parent's Right To Withhold Consent For Any Treatment, Activity Or Mental Health Care Services That Are Designed And Intended To Form Their Child's Conceptions Of Sex And Gender Or To Treat Gender Dysphoria Or Gender Nonconformity; To Prohibit Certain Medical Procedures From Being Performed Upon A Minor; To Provide A Penalty For Any Medical Profession Who Performs Certain Medical Procedures Upon A Minor; To Provide A Good-faith Exception For A Minor Born With A Medically Verifiable Genetic Disorder Of Sexual Development; To Prohibit Any State Agency, Political Subdivision Or Licensing Organization From Forbidding, Penalizing Or Taking Adverse Action Against An Individual Who Gives Or Receives Counsel, Advice, Guidance Or Other Speech Or Communication Consistent With Conscience Or Religious Belief; To Provide That No Individual Shall Be Discriminated Against For Providing Information About A Violation Of This Act To Certain Authorities; To Provide A Private Cause Of Action For Violations Of This Act; To Preempt Political Subdivisions From Promulgating Rules Or Regulations That Limits The Professional Conduct And Judgment Of A Mental Health Care Professional Or Counselor; To Provide That The Provisions Of This Act Are Severable; And For Related Purposes.",Healthcare,Dead/Failed,https://legiscan.com/MS/bill/SB2111/2022
2022-02-01,Mississippi,HB1147,"An Act To Amend Section 43-21-105, Mississippi Code Of 1972, To Revise The Definition Of Child Abuse To Include Gender Reassignment; And For Related Purposes.",Healthcare,Dead/Failed,https://legiscan.com/MS/bill/HB1147/2022
2022-02-01,Mississippi,SB2728,An Act To Enact The Mississippi Save Adolescents From Experimentation (safe) Act; To Provide For The Legislative Findings Related To The Safe Act; To Define Certain Terms Used In The Act; To Provide That A Physician Or Other Health Care Professional Shall Not Provide Gender Transition Procedures To Any Individual Under 18 Years Of Age; To Provide That A Physician Or Other Health Care Professional Shall Not Refer Any Individual Under 18 Years Of Age To Any Health Care Professional For Gender Transition Procedures; To Allow For Certain Exceptions To The Prohibition That Physicians Cannot Provide Such Services; To Provide That Public Funds Shall Not Be Distributed To Any Entity Or Individual That Provides Gender Transition Procedures To An Individual Under 18 Years Of Age; To Provide For Enforcement Of The Act; To Prohibit A Health Benefit Plan Under An Insurance Plan From Providing Insurance Coverage Of Gender Transition Procedures For Minors; And For Related Purposes.,Healthcare,Dead/Failed,https://legiscan.com/MS/bill/SB2728/2022
2022-01-31,Arizona,HB2608,Gender transition; prohibition,Healthcare,Introduced,https://legiscan.com/AZ/bill/HB2608/2022
2022-01-28,Illinois,HB5505,"Creates the Parental Access and Curriculum Transparency Act, which may be referred to as PACT. Makes findings. Provides that no public school district or public institution of higher education shall direct, require, or otherwise compel a student to personally affirm, adopt, or adhere to specified tenets. Provides that, notwithstanding any other provision of law or administrative rule to the contrary, a school board, parent, legal guardian, or student has the right to object to and refuse any unit of instruction or required course of study that directs, requires, or otherwise compels a student to personally affirm, adopt, or adhere to any of the specified tenets. Provides that school boards have the ultimate obligation to review and resolve objections to school curriculum. Provides a list of ways to resolve objections. Provides that a school board may submit a certified question to the applicable board of elections to approve or disapprove of funding certain curriculum. Provides that, notwithstanding any provision of law to the contrary, no distinction or classification of students shall be made on account of race or color, but nothing in the provisions shall be construed to prohibit the required collection or reporting of demographic data by public school districts or public institutions of higher education. Effective immediately.",Schools / Education,Introduced*,https://legiscan.com/IL/bill/HB5505/2021
2022-01-21,West Virginia,HB4315,Ban people from picking a correctional facility based on their gender choice,Other,Introduced*,https://legiscan.com/WV/bill/HB4315/2022
2022-01-21,Virginia,SB766,"Schools; athletics; participation in female sports; civil cause of action. Requires each elementary or secondary school or a private school that competes in sponsored athletic events against such public schools to designate athletic teams, whether a school athletic team or an intramural team sponsored by such school, based on biological sex as follows: (i) ""males,"" ""men,"" or ""boys""; (ii) ""females,"" ""women,"" or ""girls""; or (iii) ""coed"" or ""mixed."" Under the bill, male students are not permitted to participate on any school athletic team or squad designated for ""females,"" ""women,"" or ""girls""; however, this provision does not apply to physical education classes at schools. The bill provides civil penalties for students and schools that suffer harm as a result of a violation of the bill. Such civil actions are required to be initiated within two years after the harm occurred.  Schools; athletics; participation in female sports; civil cause of action. Requires each elementary or secondary school or a private school that competes in sponsored athletic events against such public schools to designate athletic teams, whether a school athletic team or an intramural team sponsored by such school, based on biological sex as follows: (i) ""males,"" ""men,"" or ""boys""; (ii) ""females,"" ""women,"" or ""girls""; or (iii) ""coed"" or ""mixed."" Under the bill, male students are not permitted to participate on any school athletic team or squad designated for ""females,"" ""women,"" or ""girls""; however, this provision does not apply to physical education classes at schools. The bill provides civil penalties for students and schools that suffer harm as a result of a violation of the bill. Such civil actions are required to be initiated within two years after the harm occurred.",Youth Athletics,Introduced*,https://legiscan.com/VA/bill/SB766/2022
2022-01-20,Arizona,HB2294,State documents; sex identification,ID Updates,Introduced,https://legiscan.com/AZ/bill/HB2294/2022
2022-01-20,Tennessee,SB1862,"As introduced, prohibits males from participating in public higher education sports that are designated for females; creates a cause of action for violations that deprive a student of an athletic opportunity or that cause direct or indirect harm to a student at the middle school, high school, or postsecondary level. - Amends TCA Title 49.",Youth Athletics,Introduced,https://legiscan.com/TN/bill/SB1862/2021
2022-01-20,Tennessee,HB1894,"As introduced, prohibits males from participating in public higher education sports that are designated for females; creates a cause of action for violations that deprive a student of an athletic opportunity or that cause direct or indirect harm to a student at the middle school, high school, or postsecondary level. - Amends TCA Title 49.",Youth Athletics,Introduced,https://legiscan.com/TN/bill/HB1894/2021
2022-01-20,Arizona,HB2314,Public schools; restrooms; reasonable accommodations,Public Facilities,Introduced,https://legiscan.com/AZ/bill/HB2314/2022
2022-01-19,Arizona,HB2285,Sex education; child abuse prevention,Youth Athletics,Introduced,https://legiscan.com/AZ/bill/HB2285/2022
2022-01-18,Arizona,HB2293,School employees; students; gender pronouns,Schools / Education,Introduced,https://legiscan.com/AZ/bill/HB2293/2022
2022-01-18,Arizona,HB2292,Birth certificates; gender,ID Updates,Introduced,https://legiscan.com/AZ/bill/HB2292/2022
2022-01-18,Missouri,HB2461,Establishes guidelines for public school student participation in athletic contests organized by sex,Youth Athletics,Introduced,https://legiscan.com/MO/bill/HB2461/2022
2022-01-18,Alaska,HB230,"An Act relating to school athletics, recreation, athletic teams, and sports.",Youth Athletics,Introduced,https://legiscan.com/AK/bill/HB230/2021
2022-01-18,Alabama,HB150,"Public health, medical procedures for minors intended to alter appearance of gender prohibited, exceptions provided, criminal penalties provided",Healthcare,Introduced,https://legiscan.com/AL/bill/HB150/2022
2022-01-13,Washington,HB1960,Concerning the housing of inmates in state correctional facilities.,Public Facilities,Introduced*,https://legiscan.com/WA/bill/HB1960/2021
2022-01-13,Iowa,SF2025,A bill for an act prohibiting persons from entering single and multiple occupancy toilet facilities in elementary and secondary schools that do not correspond with the person's biological sex.,Public Facilities,Introduced*,https://legiscan.com/IA/bill/SF2025/2021
2022-01-12,Virginia,HB988,"Treatment of transgender students; model policies. Eliminates the requirement that each school board adopt policies that are consistent with the model policies developed by the Department of Education concerning the treatment of transgender students in public elementary and secondary schools. The bill also removes the requirement for such model policies to include information, guidance, procedures, and standards relating to the use of school facilities, requires the Department to amend its model policies to remove any such information, guidance, procedures, or standards, and requires the Department to make such amended model policies available to each school board no later than the beginning of the 2022 - 2023 school year.",Public Facilities,Introduced*,https://legiscan.com/VA/bill/HB988/2022
2022-01-12,United States,SB3481,Establishes a framework to prohibit correctional institutions at the federal and state levels from using gender identity to house inmates of one biological sex with inmates of the other biological sex.,Other,Introduced,https://legiscan.com/US/bill/SB3481/2021
2022-01-12,West Virginia,HB2171,Vulnerable Child Protection Act,Healthcare,Introduced*,https://legiscan.com/WV/bill/HB2171/2022
2022-01-12,Virginia,HB1126,"Public education; parental rights; access to certain Public education; parental rights; access to certain facilities and accommodations; instructional content; bullying. Declares that the parent of any student enrolled in a public elementary or secondary school in the Commonwealth has the right to (i) obtain and review any educational material and curriculum utilized in any class or course in which the student is enrolled; (ii) opt his child out of any class or course activity, lesson, or reading assignment or the use of any audiovisual material or library book to which the parent objects; (iii) easily access a list of the title and author of each book in each classroom and each library in the school in which the student is enrolled; (iv) receive notice of and attend any public meeting of the school board governing the local school division in which the student is enrolled; (v) review the annual school division budget and expenditures; (vi) send his child to attend school in a safe environment; and (vii) be updated by the school principal on any violent activity in the school in which the student is enrolled. The bill requires each school board to adopt policies to require each student and school board employee to have access to restrooms, locker rooms, and other changing facilities in public school buildings that are shared only by members of the same biological sex; lodging accommodations during school-sponsored trips that are shared only by members of the same biological sex; and a single-user restroom, locker room, or other changing facility in a public school building, upon request, if the school can reasonably accommodate such a request. The bill also prohibits any school board employee or individual who provides any school-sponsored program from teaching or promoting to any student or school board employee the concept that (a) any race is inherently superior or inferior; (b) any individual is racist, privileged, oppressive, biased, or responsible for actions committed by others of the same race or skin color by virtue of the individual's race or skin color; (c) the United States is fundamentally racist; or (d) market-based economics is inherently racist. The bill finally requires each school board to implement policies and procedures to educate school board employees about bullying and the need to create a school environment in which all individuals are treated with dignity and respect and any incident of bullying is taken seriously and handled in a robust manner.",Public Facilities,Introduced*,https://legiscan.com/VA/bill/HB1126/2022
2022-01-12,Indiana,SB0402,"Family and juvenile law matters. Requires the office of the secretary of family and social services to apply, before July 1, 2022, to the United States Department of Health and Human Services for an amendment to the family and support services Medicaid waiver to create priority status on the waiver for a child who has been adopted. Requires the statewide child fatality review coordinator to provide a data collection form to each local child fatality review team. Provides that the data collection form must mirror the information in the National Fatality Review Case Reporting System Version 5.0 CDR Report Form. Provides that the definition of child abuse or neglect does not refer to a person who identifies a child by the child's biological sex. Requires the department of child services (department) to include in its annual report certain additional information concerning child fatalities. Requires the department to: (1) collect certain disability identification data; (2) create a report concerning the collected data; (3) provide the report to the legislative council; and (4) adopt rules to implement these provisions. Requires the department, before beginning a trial home visit, to conduct a criminal history check on certain individuals, determine whether any of those individuals have prior department history, and establish a safety plan and child care plan. Requires the department to conduct at least one unannounced home visit each week while a child is on a trial home visit. Makes an appropriation to the state department of health to fund additional staff to support local child fatality review teams. Makes conforming changes.",Other,Introduced*,https://legiscan.com/IN/bill/SB0402/2022
2022-01-12,Arizona,SB1130,Child; vulnerable adult; abuse,Healthcare,Introduced,https://legiscan.com/AZ/bill/SB1130/2022
2022-01-11,South Dakota,HB1006,Promote continued fairness in women's sports.,Youth Athletics,Introduced*,https://legiscan.com/SD/bill/HB1006/2022
2022-01-11,New Jersey,S589,""Fairness in Women's Sport Act."",Youth Athletics,Introduced,https://legiscan.com/NJ/bill/S589/2022
2022-01-11,New Jersey,A1630,""Fairness in Women's Sport Act."",Youth Athletics,Introduced,https://legiscan.com/NJ/bill/A1630/2022
2022-01-11,Kentucky,SB84,"Create new sections of KRS Chapter 311 to prohibit the provision of or referral for gender transition procedures to any child under the age of 18 years; define a violation as unprofessional conduct and acting recklessly for purposes of tort claims; permit an action on a violation to be taken by the parent or guardian of the child before the child attains the age of 18 years and by the child within 30 years of the child attaining the age of 18 years, with exceptions under which the time may be longer; require conditions for actions and damages; prohibit public funds to be used for the provision of or referral for gender transition procedures to a child under the age of 18 years; prohibit health care services provided under state, local, or county government to include gender transition procedures to a child under the age of 18 years; prohibit tax exemption for gender transition procedures; permit the Attorney General to bring action to enforce provisions; permit members of the General Assembly to intervene as a matter of right if these provisions are challenged; create a new section of KRS Chapter 205 to prohibit Medicaid coverage of gender transition procedures for a child under the age of 18 years; create a new section of KRS Chapter 304.17A to prohibit health benefit plan coverage for gender transition procedures for a child under the age of 18 years and any requirement for coverage of gender transition procedures; EFFECTIVE January 1, 2023.",Healthcare,Introduced,https://legiscan.com/KY/bill/SB84/2022
2022-01-11,Alabama,SB5,"Public health, prohibits medical procedures on minor children intended to alter apprearance of gender with exceptions, provides for certain disclosures by school officials, establishes criminal penalties",Healthcare,Introduced,https://legiscan.com/AL/bill/SB5/2022
2022-01-10,Arizona,SB1045,Minors; gender identity; reassignment; prohibitions,Healthcare,Introduced,https://legiscan.com/AZ/bill/SB1045/2022
2022-01-08,Kentucky,HB253,"Create new sections of KRS Chapter 311 to prohibit the provision of or referral for gender transition procedures to any child under the age of 18 years; define a violation as unprofessional conduct and acting recklessly for purposes of tort claims; permit an action on a violation to be taken by the parent or guardian of the child before the child attains the age of 18 years and by the child within 30 years of the child attaining the age of 18 years, with exceptions under which the time may be longer; require conditions for actions and damages; prohibit public funds to be used for the provision of or referral for gender transition procedures to a child under the age of 18 years; prohibit health care services provided under state, local, or county government to include gender transition procedures to a child under the age of 18 years; prohibit tax exemption for gender transition procedures; permit the Attorney General to bring action to enforce provisions; permit members of the General Assembly to intervene as a matter of right if these provisions are challenged; create a new section of KRS Chapter 205 to prohibit Medicaid coverage of gender transition procedures for a child under the age of 18 years; create a new section of KRS Chapter 304.17A to prohibit health benefit plan coverage for gender transition procedures for a child under the age of 18 years and any requirement for coverage of gender transition procedures; amend KRS 141.019 and 141.039 to prohibit tax exemption for gender transition procedures; EFFECTIVE January 1, 2023.",Healthcare,Introduced,https://legiscan.com/KY/bill/HB253/2022
2022-01-08,Kentucky,HB247,"Amend KRS 156.070 to designate the NAIA and NJCAA as organizations the Kentucky Board of Education must consider in establishing athletic programs, require the Board of Education or agency designated by the Board of Education to manage interscholastic athletics to promulgate administrative regulations or bylaws requiring schools that participate in interscholastic athletics to designate all athletic teams, activities, and sports based upon the biological sex of the students eligible to participate; prohibit male students from participating in athletic teams, activities, and sports designated as girls'; prohibit designated agencies from entertaining complaints or investigations of policies; a new section of KRS Chapter 158 to create a cause of action against a school that violates these provisions; require that the action be brought within two years; create a new section of KRS Chapter 164 to require a postsecondary education institution to designate all intercollegiate and intramural athletic teams, activities, sports, and events that are sponsored or authorized by the institution based on biological sex of students eligible to participate; require that a postsecondary education institution prohibit male students from participating in athletic teams, activities, and sports designated as women's; prohibit designated agencies from entertaining complaints or investigations of policies; create a cause of action against a postsecondary institution that violates these provisions; require that the action be brought within two years; provide short title of Save Women’s Sports Act.",Youth Athletics,Introduced,https://legiscan.com/KY/bill/HB247/2022
2022-01-05,Missouri,HB2086,Prohibits changing sex on birth certificates,ID Updates,Introduced,https://legiscan.com/MO/bill/HB2086/2022
2022-01-05,Missouri,HB1634,Prohibits the use of any curriculum implementing critical race theory in the public schools and institutions of higher education of the state.,Schools / Education,Introduced,https://legiscan.com/MO/bill/HB1634/2022
2022-01-05,Missouri,SB843,Modifies provisions relating to gender reassignment treatment for children,Healthcare,Introduced,https://legiscan.com/MO/bill/SB843/2022
2022-01-05,Missouri,HB2197,Establishes guidelines for student participation in athletic contests organized by sex,Youth Athletics,Introduced,https://legiscan.com/MO/bill/HB2197/2022
2022-01-05,Missouri,SB740,Modifies and creates provisions regarding elementary and secondary education,Youth Athletics,Introduced,https://legiscan.com/MO/bill/SB740/2022
2022-01-05,Missouri,SB781,"Establishes the ""Save Women's Sports Act"" relating to female-only athletics in middle school, high schools, and colleges",Youth Athletics,Introduced,https://legiscan.com/MO/bill/SB781/2022
2022-01-04,Kentucky,HB23,Amend KRS 156.070 to require KHSAA to promulgate administrative regulations or bylaws requiring schools to designate all interscholastic athletics based upon the biological sex of the students eligible to participate; prohibit male students from participating in girls' athletics; establish how to designate biological sex; prohibit designated agencies from entertaining complaints or investigations of policies; create a cause of action against a school that violates these provisions; create a new section of KRS Chapter 164 to require a public postsecondary education institution or private postsecondary education institution that is a member of a national intercollegiate athletic association to designate all intercollegiate and intramural athletics authorized by the institution based on biological sex of students eligible to participate; require that institutions prohibit male students from participating in womens' athletics; prohibit designated agencies from entertaining complaints or investigations of policies; create a cause of action against a postsecondary institution that violates these provisions; title the Act ""Fairness in Womens' Sports Act."",Youth Athletics,Introduced,https://legiscan.com/KY/bill/HB23/2022
2022-01-04,Indiana,SB0034,"Prohibited services relating to care of minors. Prohibits specified health care professionals from: (1) performing certain medical procedures on a minor; or (2) subjecting a minor to certain activities; that purposely attempt to change, reinforce, or affirm a minor's perception of the minor's own sexual attraction or sexual behavior, or attempt to change, reinforce, or affirm a minor's gender identity when the identity is inconsistent with the minor's biological sex.",Healthcare,Introduced*,https://legiscan.com/IN/bill/SB0034/2022
